{
  "format": "workbench-supersymmetry-release-client-install-policy-v1",
  "schema_version": 1,
  "profile": "supersymmetry",
  "minecraft_version": "1.12.2",
  "launcher": "prism",
  "platform_profile_id": "workbench-platform:cleanroom:provisional",
  "cleanroom_version": "0.6.12-alpha",
  "cleanroom_client": {
    "size": 58132,
    "sha256": "sha256:d6536796df0ce02e043f7cec59d344fca7c0dee00f013dd4d89a7a0db4c4cb32"
  },
  "recommended_java_feature": 25,
  "memory_mib": 8192,
  "accepted_source_limitations": [
    "external-file-origin-unverified",
    "runtime-compatibility-unqualified"
  ]
}
